,reviews_classified2
0,de que adianta ter um aplicativo se qualquer coisinha que voce faz o banco cancela sua assinatura eletronica se eu quisesse ir na agencia resolver as coisas eu nao baixava aplicativo para ser ruim precisa melhorar muito ainda pessimo servico
1,amo esse aplicativo so nao gostei de ter que cadastrar a assinatura eletronicaou senha eletronicaso la no caixa economica pessoalmenteem pleno pandemia era pra fazer via internet
2,e bom mas cometeu um erro grave comigo em um tev pediu a assinatura eletronica e automaticamente confirmou o destino sem minha autorizacao em equivoco foi feito um pagamento indevido e o gerente da minha conta fez um pedido ao gerente final mas sem esperanca de retorno teria que recorrer as pequenas causasno aplicativo do bradesco funciona assim ele pergunta depois da assinatura e essa pessoa o destinatario você olha e confirma esse da caixa apresentou o receptor depois de concluido
3,aplicativo pessimo sai toda hora da biometria pior burocracia pra recuperar senha sem falar da assinatura eletronica que e um bo pra poder criar e se esquecer ja e outros porens bem que deveriam atualizar esse aplicativo e facilitar com a nossa vida fazendo essas mudancas no aplicativo pessima experiencia ja nao uso mais
4,o aplicativo estava bom mas agora nao da pra fazer nada nele inves de adquirir novas funcionalidade pra ajudar as pessoas nao voces simplesmente piora tudo pois nem saldo da pra ve se nao fizer uma assinatura eletronica que melhora isso pode proporcionar existem pessoas que nao podem ir num caixa eletronico porque na cidade nao tem aqui por exemplonao tem pra fazer isso preciso ir pra outra cidade porque aqui nao tem poxa o aplicativo usava muito e agora tive que desinstala
5,tenho uma conta moro em uma cidade a mais de 300km da agencia para desbloquear o aplicativo tive que ir a agencia e agora so da assinatura bloqueada
6,pessimo aplicativo um lixo tive que reinstala e ai tenho que fazer tudo de novo inclusive ir no caixa fazer minha assinatura eletronica de novo e um lixo mesmo ta doido como pode ser coisa para o povo se e um lixo desse nao precisa me mandar mensagem nao porque minha opiniao nao vai mudar nao sou obrigada a ficar indo em agencia desbloquear nada toda hora sai fora vou mandar cancelar essa conta
7,o meu problema e com o pix minha cidade nao tem caixa eletronico e nao tem com eu ir e outra cidade desbloquear a assinatura eletronica voces tem que ver isso ai fica dificil
8,foi muito bom agora esta pessimo nao consigo fazer nada tem que ir no caixa eletronico desbloquear assinatura toda vez da erro cansada da caixa nao consigo fazer nada em um momento tao dificil para mim agora o aplicativo esta otimo
10,o aplicativo e muito ruim toda hora instavel toda hora da erro de autenticacao biometrica tem que melhorar muito
11,pode melhor reduzindo a instabilidade principalmente do sistema de biometria
12,precisa melhorar porque da muitoerro na biometria e o leitor nao funciona para pix e pagamentos e e somente esse aplicativo que fica assim em relacao aos outros bancos que eu tenho
13,completamente instavel problema na biometria tendo que cadastrar o tempo inteiro o aplicativo fica mais tempo fora do ar do que util para usar oq era p ser uma coisa facil vira um pesadelo e deixa os usuarios descontentes e irritados por essa falta de atualizacao e bugs
14,nao deixa entrar nem por biometria nem senha fica dando erro pedindo pra tentar novamente por isso e facil migrar pra qualquer outro banco nao deixa fazer nada
15,sempre tenho poblemas com a biometria e nao tem a opcao de esqueci a senha tenho que desistalar e estalar precisa melhorar
16,o aplicativo esta instavel voce conta em poder acessar a sua conta para fazer pagamentos e transferencias ou seja resolver a sua vida financeira mas nao da para contar com esse aplicativo a biometria toda hora para de funcionar uso aplicativo de outro banco que nunca da problema entao o problema e a incompetencia mesmo
17,aplicativo com instabilidade frequentemente fecha sozinho sai da conta nao acessa com biometria se precisar fazer alguma transacao com urgencia pode esquecer
18,precisa melhorar instabilidade login biometria fora de conexao erros constantes complicado
19,o aplicativo sempre apresenta problemas no login da erro varias vezes alem do problema com a biometria e reconhecimento facial precisa melhorar e muito
20,revoltada com esse aplicativo que ele e ruim eu ja sabia mas ultimamente esta pior depositei um dinheiro pra pagar as contas e estou a mais de 2h tentando entrar e nao vai sai sozinho da erro na biometria manda tentar de novo um lixo uma humilhacao com o cliente
21,pessimo muitos erros na biometria cai de repente durante o usa e sem falar que para pagamento mais erros como falha ao ler o codigo de barras impossivel as vezes deveriam melhor muito comparado a de outros bancos por ai
22,o aplicativo sai do ar sempre alem de alguns erros pra entrar com biometria precisa ser melhorado urgente
23,de tempos em tempos o aplicativo da problema com a biometria do iphone mesmo desativando a biometria eu tenho que digitar a senha umas 5 vezes para entrar no aplicativo pra ficar ruim esse aplicativo precisa melhorar muito pois e pessimo nunca corrigem esses bugs e muita incompetencia...
24,aplicativo pessimo sai toda hora da biometria pior burocracia pra recuperar senha sem falar da assinatura eletronica que e um bo pra poder criar e se esquecer ja e outros porens bem que deveriam atualizar esse aplicativo e facilitar com a nossa vida fazendo essas mudancas no aplicativo pessima experiencia ja nao uso mais
25,otimo porem com algumas inconsistencia no acessar com biometriaestava assim a alguns dias atras agora melhorou
26,he nubank bandidos fazendo a festa com roubo de celulares e o aplicativo de voces so deixa logar com biometria ou passcode se o malandro pede tem a senha do celular ele rouba toda a minha grana no aplicativo sabia vamos melhorar essa seguranca ai urgente por favor
27,olha software e muito bom mais assim reconhecimento facial muito ruim nao e todo dispositivo movel que tenha camera de reconhecimento facial gera comflito ao estalar o aplicativo poderia ter uma desativacao pelo gmail fora isso otimo aplicativo
28,o pagamento dos boletos demoram ser reconhecidos qndo fuzemos pagamentos dos creditos me refiro entra 3 dias depois
29,muito fraco pra da linha de creditodemora muito pra reconhecer seus clientes
30,nao estou consiguindo valida meu dispositivo de jeito nemhum o reconcimento facial parece que nao ta me reconhecedo que fala pra seguir a estrucao ja seguir e tudo
31,ja faz mais de 15 dias que tento acessar o aplicativo e nao consigo porque o aplicativo nao entra pra eu fazer meu reconhecimento facial o aplicativo nao presta
32,esta longe de ser sem defeitos mas melhoras a cada dia deveria ser mais facil colar codigo de barras e nao haver distincao entre formatos de boletos deveria ser capaz de reconhecer automatico tipos de boletos assim como aplicativo de cooperativas
33,faz meses que nao esta lendo o codigo de barras ai tenho que fazer um pix pra outra conta minha de outro banco pra poder efetuar pagamentos de boletos e também toda vida que o aplicativo reconhece algum pagamento também ou pix ao abrir o aplicativo sempre dar erro...nao salva os pix quando fazemos a gente que tem que favoritar enfim sao muitas coisinhas que da pra melhorar
34,aplicativo ruim sempre trava e fica saindo do ar pra piorar parou de reconhecer codigo de barras para pagamento de boletos
35,antes demorava pra abrir e reconhecer os codigos copiados da area de transferencia isso parece estar resolvido
36,o aplicativo sempre apresenta problemas no login da erro varias vezes alem do problema com a biometria e reconhecimento facial precisa melhorar e muito
37,e bom mas sempre pode melhorar as vezes nao reconhece a senha e preciso recadastrar
38,pessimo todo dia tem um erro diferente ja tem um tempo que nao estava nem abrindo agora que abriu nao esta reconhecendo meu celular que ja e ativado e pra piorar nao da continuidade pra cadastrar fica em um carregamento infinito esperando escolher o apelido para cadastrar o aparelho sendo que era pra eu escolher e nao o aplicativo
39,queria entender com tanta tecnologia e o aplicativo de vcs nao pode simplesmente validar o uso do aplicativo por reconhecimento facial tive um imprevisto estou numa localidade longe e nao tenho acesso a conta pela burocracia de vcs sinceramente viu
40,pessima tento entrar em minha conta e so diz que nao reconhece usuario
41,otimo aplicativo mais poderia ter opcoes de liberacoes de dispositivos por reconhecimento facial
42,nao consigo adicionar a minha conta poupanca ao aplicativo nao reconhece o no da conta parece que mudou o no da consulta mais nao me passaram o novo numero
43,vem atendendo as minhas espectativas o aplicativo melhorou bastante desde a sua criacao a unica coisa que eu nao gosto e quando você muda de aparelho celular porque tem que cadastrar o novo aparelho e e muita burocracia deveriam fazer somente o reconhecimento facial como os bancos digitais fazem
44,ta ruim demais usar esse aplicativo eu coloco cpf e senha e na hora de colocar a digital ele reconhece mas fica voltando para a tela da digital e nunca entra na pagina da conta cansei